talk_id,para_id,entity_id,before,entities,after,label
75,16,13," Antarctica, if you include the ice shelves, is twice the size of ",Australia,— it's a big place,LOC
75,16,14, And there's a race to get to the Pole between ,Amundsen," the Norwegian — Amundsen had dog sleds and huskies — and Scott, the British guy, Captain Scott",LOC
75,16,16," And there's a race to get to the Pole between Amundsen, the Norwegian — ",Amundsen,"had dog sleds and huskies — and Scott, the British guy, Captain Scott",ORG
75,16,17," And there's a race to get to the Pole between Amundsen, the Norwegian — Amundsen had dog sleds and huskies — and ",Scott," the British guy, Captain Scott",PERSON
75,16,19," And there's a race to get to the Pole between Amundsen, the Norwegian — Amundsen had dog sleds and huskies — and Scott, the British guy, Captain ",Scott," Scott had sort of ponies and some tractors and a few dogs, all of which went wrong, and Scott and his team of four people ended up on foot",PERSON
75,16,20, ,Scott,"had sort of ponies and some tractors and a few dogs, all of which went wrong, and Scott and his team of four people ended up on foot",PERSON
75,16,21," Scott had sort of ponies and some tractors and a few dogs, all of which went wrong, and ",Scott,and his team of four people ended up on foot,PERSON
75,16,28," Since then, no one has ever skied — this was 93 years ago — since then, no one has ever skied from the coast of ",Antarctica,to the Pole and back,LOC
75,16,29," Since then, no one has ever skied — this was 93 years ago — since then, no one has ever skied from the coast of Antarctica to the ",Pole,and back,LOC
75,16,30, Every ,South Pole,expedition you may have heard about is either flown out from the Pole or has used vehicles or dogs or kites to do some kind of crossing — no one has ever made a return journey,LOC
75,16,31, Every South Pole expedition you may have heard about is either flown out from the ,Pole,or has used vehicles or dogs or kites to do some kind of crossing — no one has ever made a return journey,LOC
75,17,2," It says, """,Ben,lacks sufficient impetus to achieve anything worthwhile,PERSON
77,1,0,Song: Before God destroyed the people on the ,Earth, he warned Noah to build an Ark,LOC
77,1,1,"Song: Before God destroyed the people on the Earth, he warned ",Noah,to build an Ark,PERSON
77,1,2, And after ,Noah,"built his Ark, I believe he told Noah to warn the people that they must change all their wicked ways before he come upon them and destroy them",PERSON
77,1,3, And after Noah built his ,Ark, I believe he told Noah to warn the people that they must change all their wicked ways before he come upon them and destroy them,PERSON
77,1,4," And after Noah built his Ark, I believe he told ",Noah,to warn the people that they must change all their wicked ways before he come upon them and destroy them,PERSON
77,1,5, And when ,Noah,"had done built his Ark, I understand that somebody began to rend a song",PERSON
77,1,6, And when Noah had done built his ,Ark, I understand that somebody began to rend a song,PERSON
77,1,7, And when ,Noah,had done built his Ark ,PERSON
77,1,8, And when Noah had done built his ,Ark,,PERSON
77,1,9," And old lady ran to the door and say, ""Who is it?"" ",Jack,"say, ""Me, Mama-san, could we spend the night here? Because we’re far from home, we’re very tired",PERSON
77,1,10," And old lady ran to the door and say, ""Who is it?"" Jack say, ""","Me, Mama-san"," could we spend the night here? Because we’re far from home, we’re very tired",WORK_OF_ART
78,11,0,But the patent for underwater flight — ,Karen,"and I, we were looking at it, some business partners wanted us to patent it — we weren’t sure about that",PERSON
78,11,1, It just seems wrong to try and patent — (,Applause, — the freedom for underwater flight,LOC
78,11,2, We developed some other technology called ,spider optics," and Craig Ventner asked me to make an announcement here this morning: we’re going to be building a beautiful, little, small version of this — unmanned, super deep — for his boat to go and get back some deep sea DNA stuff",ORG
78,11,3," We developed some other technology called spider optics, and ",Craig Ventner,"asked me to make an announcement here this morning: we’re going to be building a beautiful, little, small version of this — unmanned, super deep — for his boat to go and get back some deep sea DNA stuff",PERSON
79,4,10," That's one actor, ",the Security Council,,ORG
79,7,4, ,The United Nations,even has an agency which could broker these compacts; it's called the Peace Building Commission,ORG
79,7,5, The United Nations even has an agency which could broker these compacts; it's called ,the Peace Building Commission,,ORG
79,17,1," Paddy Ashdown, who was the grand high nabob of ",Bosnia,"to the United Nations, in his book about his experience, he said, ""I realize what I needed was accountants without borders, to follow that money",LOC
79,17,2," Paddy Ashdown, who was the grand high nabob of Bosnia to ",the United Nations," in his book about his experience, he said, ""I realize what I needed was accountants without borders, to follow that money",ORG
80,5,9, ,ft," instead of 600, immediately I'm saving 200 grand",PERSON
81,28,1,I guess the best way to end this is with two quotes: ,Marshall McLuhan,"said, ""Children are the messages that we send to the future,"" but in fact, if you think of it, children are the future we send to the future",PERSON
81,28,12," That means that we, once again, have a thing where we can put technology out, but the mentoring that is required to go from a simple new ",iChat,instant messaging system to something with depth is missing,ORG
81,28,15," It sounds like a lot, but it is literally 18 minutes of what we're spending in ",Iraq,— we're spending 8 billion dollars a month; 18 minutes is 100 million dollars — so this is actually cheap,LOC
81,28,19, And ,Einstein,"said, ""Things should be as simple as possible, but not simpler",PERSON
82,9,1,"This is an image from Saturday, photographed by the ",Aqua,"satellite, but through the Uniview software",PERSON
82,9,2,"This is an image from Saturday, photographed by the Aqua satellite, but through the ",Uniview,software,LOC
82,9,3, So you're seeing the edge of the ,Earth, This is Nepal,LOC
82,9,4, This is ,Nepal," This is, in fact, right here is the valley of Lhasa, right here in Tibet",LOC
82,9,5," This is, in fact, right here is the valley of ",Lhasa, right here in Tibet,LOC
82,9,6," This is, in fact, right here is the valley of Lhasa, right here in ",Tibet, But we can see the haze from fires and so forth in the Ganges valley down below in India,LOC
82,9,7, But we can see the haze from fires and so forth in the ,Ganges valley,down below in India,LOC
82,9,8, But we can see the haze from fires and so forth in the Ganges valley down below in ,India, This is Nepal and Tibet,LOC
82,9,9, This is ,Nepal,and Tibet,LOC
82,9,10, This is Nepal and ,Tibet,,LOC
83,8,9," Now, congestion charges were introduced in ",Stockholm,"on January 3, 2006, and the first picture here is a picture of Stockholm, one of the typical streets, January 2",LOC
83,8,12," Now, congestion charges were introduced in Stockholm on January 3, 2006, and the first picture here is a picture of ",Stockholm," one of the typical streets, January 2",LOC
83,12,6," No, on the contrary, they changed, up to a point where we now have 70 percent support for keeping the charges, meaning that — I mean, let me repeat that: 70 percent of the population in ",Stockholm,want to keep a price for something that used to be free,LOC
84,0,1, It was ,Edwin Hubble,"who first noticed that our universe is expanding, by noting that galaxies seem to be flying further and further apart",PERSON
85,27,9, I'm probably the only person you'll ever meet who rode his bicycle across ,the Sahara desert,without sunscreen,LOC
85,27,10," But I'll tell you, there is no adventure more harrowing than riding shotgun with ",Marge Deton," ""A stranger is a friend I haven't met yet!"" she'd say to me",PERSON
85,28,6, These 100-year-old ,Okinawan,"women are getting up and down off the ground, they sit on the floor, 30 or 40 times a day",LOC
86,0,11," And in the process, I became the first person in history to make the entire 650-mile journey, from ",Hercules Inlet,"to South Pole, solely on feet, without skis",LOC
86,0,12," And in the process, I became the first person in history to make the entire 650-mile journey, from Hercules Inlet to ",South Pole," solely on feet, without skis",LOC
87,5,0,,♫,"Il me parle tout bas, ♫",ORG
87,6,0,,♫,Je vois la vie en rose,ORG
87,7,0,,♫,"Il me dit des mots d'amour, ♫",ORG
87,8,0,,♫,"Des mots de tous les jours, ♫",ORG
87,9,0,,♫,Et ca me fait quelque chose,ORG
87,10,0,,♫,Il est entre dans mon coeur ♫,ORG
87,10,1,♫ Il ,est entre,dans mon coeur ♫,LOC
87,11,0,,♫,Une part de bonheur ♫,ORG
87,12,0,,♫,Dont je connais la cause,ORG
87,13,0,,♫,C'est lui pour moi,ORG
87,14,0,,♫,"Dans la vie, ♫",ORG
87,15,0,,♫,"Il me l'a dit, l'a jure [pour] la vie",ORG
87,16,0,,♫,Et des que je l'apercois ♫,ORG
87,17,0,,♫,Alors je sens en moi ♫,ORG
87,18,0,,♫,Mon coeur qui bat ♫,ORG
88,17,4," One is to continue to see a poor, ill, crying ",Africa," carrying guns, that depends on other people forever, or to promote an Africa which is confident, peaceful, independent, but cognizant of its huge problems and great values at the same time",LOC
88,17,5," One is to continue to see a poor, ill, crying Africa, carrying guns, that depends on other people forever, or to promote an ",Africa,"which is confident, peaceful, independent, but cognizant of its huge problems and great values at the same time",LOC
88,17,8, And the key is to promote a positive African attitude towards ,Africa,,LOC
88,18,1,That's because we Africans concentrate — I am from ,Ethiopia," by the way — we concentrate too much on how we are seen from elsewhere, or from outside",LOC
88,18,3," So finally, I would like to say, so let's help ",Africa,"walk upright and forward, then we all can be proud of our future legacy as a species",LOC
89,7,5, We invited ,Tom Ford,"to come — the conference was called, ""Ready to Share: Fashion and the Ownership of Creativity"" — and we asked him exactly this question",PERSON
89,7,6," We invited Tom Ford to come — the conference was called, """,Ready to Share: Fashion and the Ownership of Creativity, — and we asked him exactly this question,WORK_OF_ART
89,7,7, He had just come off a successful stint as the lead designer at ,Gucci, in case you didn't know,PERSON
89,17,2," A person can come in and take somebody else's gown, cut off three inches from the bottom, go to the ",E.U.,"and register it as a new, original design",LOC
89,17,3," If you look at the registry, actually, a lot of the registered things in the ",E.U.,are Nike T-shirts that are almost identical to one another,LOC
89,17,4, are ,Nike,T-shirts that are almost identical to one another,ORG
89,25,0, And I really want to thank ,Veronica Jauriqui,for making this very fashionable presentation,PERSON
90,4,11, And at ,TED,"here in February, their passion and brilliance just took our breath away",ORG
90,24,9," Today, I see ",Kibera,in a different way,LOC
90,24,10, My message to TEDGlobal and the entire world is: ,Kibera,is a hotbed of innovation and ideas,PERSON
90,26,0,CA: You know what? I bet ,Chris,has always been an inspiring guy,PERSON
90,26,2," Right now, ",Chris,"and Kevin and Dennis and Dickson and their friends are watching us, in Nairobi, right now",PERSON
90,26,3," Right now, Chris and ",Kevin,"and Dennis and Dickson and their friends are watching us, in Nairobi, right now",PERSON
90,26,4," Right now, Chris and Kevin and ",Dennis,"and Dickson and their friends are watching us, in Nairobi, right now",PERSON
90,26,5," Right now, Chris and Kevin and Dennis and ",Dickson,"and their friends are watching us, in Nairobi, right now",PERSON
90,26,6," Right now, Chris and Kevin and Dennis and Dickson and their friends are watching us, in ",Nairobi, right now,LOC
92,33,1," And for me, one of the great stories recently was the ",Obamas,digging up the south lawn of the White House to create a vegetable garden,ORG
92,33,2," And for me, one of the great stories recently was the Obamas digging up the south lawn of ",the White House,to create a vegetable garden,ORG
92,33,3," Because the last time that was done, when ",Eleanor Roosevelt,"did it, it led to the creation of 20 million vegetable gardens across the United States",PERSON
92,33,5," Because the last time that was done, when Eleanor Roosevelt did it, it led to the creation of 20 million vegetable gardens across ",the United States,,LOC
93,8,15, She's going to give up university to look after ,Mum," We're all here, and all of those who watch it are going to be traumatized by this event, but all of you here who are victims are going to learn some hard truths",PERSON
93,9,6,", for ",Welsh,people,ORG
93,23,4," It's a question that's been tackled by many great thinkers and writers: What if society actually needs crisis to change? What if society actually needs terrorism to change and adapt for the better? It's those Bulgakov themes, it's that picture of Jesus and the Devil hand in hand in ",Gethsemane,walking into the moonlight,LOC
93,24,0,A lot of people say that communism was defeated by ,the Rolling Stones, It's a good theory,ORG
93,24,1, Maybe ,the Rolling Stones,has a place in this,ORG
93,24,2, (Music) (,Applause, Bruno Giussani: Thank you,LOC
93,24,3, (Music) (Applause) ,Bruno Giussani, Thank you,PERSON
94,5,3, Babri Masjid — one of the most beautiful mosques in ,India," built by King Babur, I think, in the 16th century — was demolished by Hindu activists",LOC
94,5,4," Babri Masjid — one of the most beautiful mosques in India, built by ",King Babur," I think, in the 16th century — was demolished by Hindu activists",LOC
94,5,11,""" I'm like, """,Dude, I'm Hindu,PERSON
94,5,13,""" (Laughter) He's like, """,Huh,"""",WORK_OF_ART
94,9,0, They're playing out ,Israel,"Palestine, India-Pakistan",LOC
94,9,1," They're playing out Israel-Palestine, ",India,Pakistan,LOC
94,9,2," They're playing out Israel-Palestine, India-",Pakistan," You know, I'm making a very important argument",LOC
95,7,7," It's important to say came, because Ken — at a meeting that I believe ",Marty Hoffart,"was also at in the mid-'90s — Ken and I stood up at the back of the meeting and said, ""Geo-engineering won't work",PERSON
95,7,8," It's important to say came, because Ken — at a meeting that I believe Marty Hoffart was also at in the mid-'90s — ",Ken,"and I stood up at the back of the meeting and said, ""Geo-engineering won't work",PERSON
95,7,9, ,Ken,"went and ran his models, and found that it did",PERSON
95,21,2,"So here's one last thought, which was said much, much better 25 years ago in the ",U.S.,National Academy report than I can say today,LOC
95,21,3, ,National Academy,report than I can say today,ORG
95,21,5, That the ,CO2,"problem, the climate problem that we've heard about, is driving lots of things — innovations in the energy technologies that will reduce emissions — but also, I think, inevitably, it will drive us towards thinking about climate and weather control, whether we like it or not",ORG
96,1,11," These are camels moving across the Rift Valley in Africa, photographed by ",Chris Johns," Shot straight down, so these are the shadows of the camels",PERSON
96,1,12, This is a rancher in ,Texas," by William Albert Allard, a great portraitist",LOC
96,1,13," This is a rancher in Texas, by ",William Albert Allard, a great portraitist,PERSON
96,1,14, And ,Jane Goodall," making her own special connection, photographed by Nick Nichols",PERSON
96,1,15," And Jane Goodall, making her own special connection, photographed by ",Nick Nichols," This is a soap disco in Spain, photographed by David Alan Harvey",PERSON
96,1,16, This is a soap disco in ,Spain, photographed by David Alan Harvey,LOC
96,1,17," This is a soap disco in Spain, photographed by ",David Alan Harvey, And David said that there was lot of weird stuff happening on the dance floor,PERSON
96,1,18, And ,David,said that there was lot of weird stuff happening on the dance floor,PERSON
96,1,19, (Laughter) These are sea lions in ,Australia,"doing their own dance, by David Doubilet",LOC
96,1,20," (Laughter) These are sea lions in Australia doing their own dance, by ",David Doubilet," And this is a comet, captured by Dr",PERSON
96,1,21, ,Euan Mason," And finally, the bow of the Titanic, without movie stars, photographed by Emory Kristof",PERSON
96,1,22," And finally, the bow of the ",Titanic," without movie stars, photographed by Emory Kristof",LOC
96,1,23," And finally, the bow of the Titanic, without movie stars, photographed by ",Emory Kristof," Photography carries a power that holds up under the relentless swirl of today's saturated, media world, because photographs emulate the way that our mind freezes a significant moment",ORG
96,13,8, And then back to the ,States,"to recuperate at veterans' hospitals, such as here in Walter Reed",LOC
96,13,9," And then back to the States to recuperate at veterans' hospitals, such as here in ",Walter Reed," And finally, often fitted with high-tech prosthesis, they exit the medical system and attempt to regain their pre-war lives",PERSON
96,13,10, ,Jim,took what could have been a straight-up medical science story and gave it a human dimension that touched our readers deeply,PERSON
96,15,2, And ,Paul,"said he was never really afraid, because she was more curious about him than threatened",PERSON
96,15,3,""" (Laughter) Then ",Paul,thinks that she simply took pity on him,PERSON
96,15,4," To her, here was this big, ",goofy,creature in the water that for some reason didn't seem to be interested in chasing penguins,PERSON
96,15,6," (Laughter) Eventually, though, ",Paul,thinks that she just figured that he was never going to survive,PERSON
96,16,0,,Paul,"set out to photograph a relatively mysterious and unknown creature, and came back with not just a collection of photographs, but an amazing experience and a great story",PERSON
97,13,5," It's Mozart as I, ",Riccardo Muti, understand it,PERSON
97,38,1, (Laughter) Did you see ,Lenny,s face? You know why? Because the meaning of the music is pain,PERSON
97,38,2, And you look at ,Lenny,and he's suffering,PERSON
97,38,4, And ,Bernstein,enables that,PERSON
97,39,0, My friend ,Peter,"says, ""If you love something, give it away",PERSON
99,45,1, Think about the kids today in ,the Arab Spring, and you see something like this that's underway,LOC
100,15,11," Right now, 95 percent of these nets are being bought by the ",U.N., and then given primarily to people around Africa,ORG
100,15,12,", and then given primarily to people around ",Africa, We're looking at building on some of the most precious resources of Africa: people,LOC
100,15,13, We're looking at building on some of the most precious resources of ,Africa, people,LOC
100,17,6, Children can sleep through the night; the ,house,looks beautiful; you hang them in the window,ORG
101,1,0,,♫,"My oh my, walking by, who’s the apple of my eye? ♫",ORG
101,2,0,,♫,"Why, it's my very own Clonie",ORG
101,3,0,,♫,"Oh, if I should stroll the hood, who knew I could look so good ♫",ORG
101,4,0,,♫,just talking on the phone to Clonie,ORG
101,5,0,,♫,"We are pals, it's cool, 'cause we're not lonely, ♫",ORG
101,6,0,,♫,shallow gene pool is nothing to my only Clonie,ORG
101,7,0,,♫,"Me and you, hustling through, holding on through thick and thin, ♫",ORG
101,8,0,,♫,"just day by day, our DNA, so the Olson twins got nothing on us",ORG
101,9,0,,♫,"We'll survive, side by side",ORG
101,10,0,,♫,"Was wealthy, but not healthy, had no one to dwell with me, ♫",ORG
101,11,0,,♫,so look who I got born — Clonie,ORG
101,12,0,,♫,"Far from broke, bored, rich folk, we don't need no natural yolk — ♫",ORG
101,13,0,,♫,"our babies come full-formed, Clonie",ORG
101,14,0,,♫,"We'll be huggable, get a publicist ♫",ORG
101,15,0,,♫,"and show them, be the most lovable thing since fucking Eminem",ORG
101,16,0,,♫,"Oh my friend, multiply, we’re a franchise, like Walt Disney or Hannibal Lecter",ORG
101,17,0,,♫,We can tell our cancer cells are more benign than old Phil Spector,ORG
101,18,0,,♫,"We’ll survive side by side, should have signed with Verve instead of Sony",ORG
101,19,0,,♫,You’re my Clonie,ORG
101,19,2," ♫ ""Oh ",Clonie, how I love you,PERSON
101,21,0,,♫,"Gee, that's swell",ORG
101,21,1, You’re my ,Clonie, ♫,PERSON
102,7,2," My wife, who is somewhere in the audience today, called me up at the office and said, """,Nigel," you need to pick our youngest son"" — Harry — ""up from school",PERSON
102,7,3," My wife, who is somewhere in the audience today, called me up at the office and said, ""Nigel, you need to pick our youngest son"" — ",Harry,"— ""up from school",PERSON
102,7,8, So I left work an hour early that afternoon and picked ,Harry,up at the school gates,PERSON
102,7,11, I then read him a chapter of ,Roald Dahl's,"""James and the Giant Peach",PERSON
102,7,12," I then read him a chapter of Roald Dahl's """,James and the Giant Peach,""" I then put him to bed, tucked him in, gave him a kiss on his forehead and said, ""Goodnight, mate,"" and walked out of his bedroom",WORK_OF_ART
102,7,14,""" I hadn't done anything, hadn't taken him to ",Disney World,or bought him a Playstation,ORG
102,7,15,""" I hadn't done anything, hadn't taken him to Disney World or bought him a ",Playstation,,ORG
103,0,4, A special protein known as ,fibrin,"forms cross-links on the top of the skin, preventing blood from flowing out and bacteria or pathogens from getting in",ORG
104,36,7, ,Portugal,"was 45 percent renewable powered, Denmark 36",LOC
104,36,9," Portugal was 45 percent renewable powered, ",Denmark 36, And it's how all of Europe can shift to renewable electricity,ORG
104,36,10, And it's how all of ,Europe,can shift to renewable electricity,LOC
104,36,11, In ,America," our aging, dirty and insecure power system has to be replaced anyway by 2050",LOC
104,43,2, Former oil man ,Maurice Strong,"said, ""Not all the fossils are in the fuel",PERSON
104,43,3,""" But as ",Edgar Woolard," who used to chair Dupont, reminds us, ""Companies hampered by old thinking won't be a problem because,"" he said,"" they simply won't be around long-term",PERSON
104,43,4,""" But as Edgar Woolard, who used to chair ",Dupont," reminds us, ""Companies hampered by old thinking won't be a problem because,"" he said,"" they simply won't be around long-term",ORG
104,45,1," And our new book """,Reinventing Fire, describes how you can capture it,WORK_OF_ART
105,11,14," And that's a transformation in which many sincerely believing Muslims — who care very, very deeply about their traditions, who do not want to compromise those values — believe, through the malleability of the technology of democracy and the malleability and synthetic capability of the technology of ",Islam, that these two ideas can work together,ORG
105,13,3," On the other hand, there's a further possibility that many Americans, swept up in the fever of a war, will say, and feel, and think that ",Islam,is the enemy somehow — that Islam ought to be construed as the enemy,ORG
105,13,4," On the other hand, there's a further possibility that many Americans, swept up in the fever of a war, will say, and feel, and think that Islam is the enemy somehow — that ",Islam,ought to be construed as the enemy,ORG
105,13,5," And even though, for political tactical reasons, the president has been very, very good about saying that ",Islam,"is not the enemy, nonetheless, there's a natural impulse when one enters war to think of the other side as an enemy",ORG
105,15,0,"Well, what I'm here to say then is, for people who are skeptical about the war, it's especially important to recognize that in the aftermath of the war there is a possibility for the government of ",the United States,and the Muslim peoples with whom it interacts to create real forms of government that are truly democratic and also truly Islamic,LOC
106,9,5, The name was ,John James," and in those days, if a family member committed a crime, the military would hold you as ransom till your family turned themselves in",PERSON
106,9,10," And he had smuggled in two comics, two comic books — """,Spiderman," and ""X-Men",PRODUCT
106,9,11," And he had smuggled in two comics, two comic books — ""Spiderman"" and """,X-Men,""" He was obsessed",WORK_OF_ART
106,9,12," And so, I remember night after night, you'd hear all these men, these really hardened criminals, huddled around ",John James," reciting, ""Take that, Spidey!"" (Laughter) It's incredible",PERSON
106,9,13," And so, I remember night after night, you'd hear all these men, these really hardened criminals, huddled around John James, reciting, ""Take that, ",Spidey,""" (Laughter) It's incredible",ORG
106,11,1, I want to end with a poem by an American poet called ,Lucille Clifton," The poem is called ""Libation,"" and it's for my friend Vusi who is in the audience here somewhere",PERSON
106,11,2," The poem is called ""Libation,"" and it's for my friend ",Vusi,who is in the audience here somewhere,PERSON
106,11,3," ""Libation, ",North Carolina, 1999,LOC
