talk_id,para_id,entity_id,before,entities,after,label
212,24,8, We were able to mobilize Ghanaians in the Diaspora to instigate change in ,Ghana,and bring about democracy in Ghana,LOC
212,24,9, We were able to mobilize Ghanaians in the Diaspora to instigate change in Ghana and bring about democracy in ,Ghana," And I know that with the Cheetahs, we can take Africa back one village at a time",LOC
212,24,10," And I know that with the Cheetahs, we can take ",Africa,back one village at a time,LOC
213,13,11," Pragmatic Chaos, like all ",Netflix,"algorithms, determines, in the end, 60 percent of what movies end up being rented",LOC
213,19,7," This is a fiber optic cable that was laid between those two cities to just be able to traffic one signal 37 times faster than you can click a mouse — just for these algorithms, just for the ",Carnival,and the Knife,ORG
213,19,8," This is a fiber optic cable that was laid between those two cities to just be able to traffic one signal 37 times faster than you can click a mouse — just for these algorithms, just for the Carnival and the ",Knife," And when you think about this, that we're running through the United States with dynamite and rock saws so that an algorithm can close the deal three microseconds faster, all for a communications framework that no human will ever know, that's a kind of manifest destiny; and we'll always look for a new frontier",PERSON
213,19,9," And when you think about this, that we're running through ",the United States,"with dynamite and rock saws so that an algorithm can close the deal three microseconds faster, all for a communications framework that no human will ever know, that's a kind of manifest destiny; and we'll always look for a new frontier",LOC
213,22,0," It's what the money motivates, that we're actually terraforming the ",Earth,itself with this kind of algorithmic efficiency,LOC
213,22,1," And in that light, you go back and you look at ",Michael Najjar's,"photographs, and you realize that they're not metaphor, they're prophecy",PERSON
213,22,3, But now there's this third co-evolutionary force: algorithms — ,the Boston Shuffler, the Carnival,ORG
213,22,4," But now there's this third co-evolutionary force: algorithms — the Boston Shuffler, the ",Carnival," And we will have to understand those as nature, and in a way, they are",ORG
214,15,0,,Steven Weinberg," the Nobel laureate, once said, ""The more the universe seems comprehensible, the more it seems pointless",PERSON
214,15,1,"Steven Weinberg, the ",Nobel,"laureate, once said, ""The more the universe seems comprehensible, the more it seems pointless",WORK_OF_ART
214,15,2, I have chosen to make silly jokes about ,quantum mechanics,and the Copenhagen interpretation,ORG
214,15,3, I have chosen to make silly jokes about quantum mechanics and the ,Copenhagen,interpretation,ORG
215,17,6, So this is work from a colleague in ,Toronto," What they showed is that, initially, you know, subjects perform where they are expected to perform given their age",LOC
215,19,2, (,Applause, (Applause),LOC
216,0,0,Could human civilization eventually spread across the whole ,Milky Way,galaxy? Could we move beyond our small blue planet to establish colonies in the multitude of star systems out there? This question's a pretty daunting one,PRODUCT
216,0,8, Their idea is based on the work of a mathematician named ,John von Neumann, who designed on paper machines that could self-replicate and create new generations of themselves,PERSON
216,0,9, These would later come to be known as ,von Neumann,machines,PERSON
216,0,10," In the context of space exploration, ",von Neumann,machines could be built on Earth and launched into space,PERSON
216,0,11," In the context of space exploration, von Neumann machines could be built on ",Earth,and launched into space,LOC
216,0,13, Scholars crunched the numbers and found that a single ,von Neumann,machine traveling at 5% of the speed of light should be able to replicate throughout our galaxy in 4 million years or less,PERSON
216,0,19, Creating ,von Neumann,"machines would require a few technologies we don't have yet, including advanced artificial intelligence, miniaturization, and better propulsion systems",PERSON
216,0,21," So then where are all these machines? Some astronomers, like ",Carl Sagan, say that intelligent aliens wouldn't build self-replicating machines at all,PERSON
216,0,22, Science fiction author ,David Brin,writes about a universe in which many different von Neumann machines exist and proliferate simultaneously,PERSON
216,0,23, Science fiction author David Brin writes about a universe in which many different ,von Neumann,machines exist and proliferate simultaneously,PERSON
216,0,24," In fact, in ",Brin,"s story ""Lungfish,"" some von Neumann machines are keeping a close watch over the Earth right now, waiting for us to reach a certain level of sophistication before they make their move",ORG
216,0,25," In fact, in Brin's story """,Lungfish,""" some von Neumann machines are keeping a close watch over the Earth right now, waiting for us to reach a certain level of sophistication before they make their move",WORK_OF_ART
216,0,26," In fact, in Brin's story ""Lungfish,"" some ",von Neumann,"machines are keeping a close watch over the Earth right now, waiting for us to reach a certain level of sophistication before they make their move",PERSON
216,0,27," In fact, in Brin's story ""Lungfish,"" some von Neumann machines are keeping a close watch over the ",Earth,"right now, waiting for us to reach a certain level of sophistication before they make their move",LOC
216,0,28," If they exist, one of them will eventually land on ",Earth," or maybe, just maybe, they're already here",LOC
217,4,7," And Aristotle’s law of motion was that everything goes to its natural place, which was of course, the rule of the society that Aristotle lived in, and more importantly, the medieval society that, through Christianity, embraced ",Aristotle,and blessed it,ORG
217,17,0, ,Science,will never go away,ORG
218,3,1," And that will have to await the arrival, back at ",Enceladus," of the spacecrafts, hopefully some time in the near future, specifically equipped to address that particular question",ORG
218,3,3, But in the meantime I invite you to imagine the day when we might journey to the ,Saturnine,"system, and visit the Enceladus interplanetary geyser park, just because we can",ORG
219,26,1, But here is a poem from ,Yeats, I'll just read you the last two lines,PERSON
219,26,3," It's called """,Among the School Children,""" ""O body swayed to music / O brightening glance / How [can we know] the dancer from the dance?"" And here is Merce Cunningham, I was fortunate to dance with him when I was younger, and here he is a dancer, and while he is dancing, he is both the dancer and the dance",WORK_OF_ART
219,26,4,""" ""O body swayed to music / O brightening glance / How [can we know] the dancer from the dance?"" And here is ",Merce Cunningham," I was fortunate to dance with him when I was younger, and here he is a dancer, and while he is dancing, he is both the dancer and the dance",PERSON
219,28,0," On the left is water coming through the shore, taken from a ",NASA,satellite,ORG
220,6,6, And if Paula decides should she marry ,Joe,"or Jack, somehow Paul sounds the most interesting",PERSON
220,6,7, And if Paula decides should she marry Joe or ,Jack, somehow Paul sounds the most interesting,PERSON
220,6,8," And if Paula decides should she marry Joe or Jack, somehow ",Paul,sounds the most interesting,PERSON
220,6,9," And so even if we make those very important decisions for very silly reasons, it remains statistically true that there are more ",Georges,living in Georgia and there are more Dennises becoming dentists and there are more Paulas who are married to Paul than statistically viable,PERSON
220,6,10," And so even if we make those very important decisions for very silly reasons, it remains statistically true that there are more Georges living in ",Georgia,and there are more Dennises becoming dentists and there are more Paulas who are married to Paul than statistically viable,LOC
220,6,11," And so even if we make those very important decisions for very silly reasons, it remains statistically true that there are more Georges living in Georgia and there are more ",Dennises,becoming dentists and there are more Paulas who are married to Paul than statistically viable,ORG
220,6,12," And so even if we make those very important decisions for very silly reasons, it remains statistically true that there are more Georges living in Georgia and there are more Dennises becoming dentists and there are more ",Paulas,who are married to Paul than statistically viable,PERSON
220,6,13," And so even if we make those very important decisions for very silly reasons, it remains statistically true that there are more Georges living in Georgia and there are more Dennises becoming dentists and there are more Paulas who are married to ",Paul,than statistically viable,PERSON
220,6,16,""" Then, of course, I looked at my mom and my dad — (Laughter) ",Karolina,"and Karl, and grandmom and granddad, Josefine and Josef",LOC
220,6,17,""" Then, of course, I looked at my mom and my dad — (Laughter) Karolina and ",Karl," and grandmom and granddad, Josefine and Josef",LOC
220,6,18,""" Then, of course, I looked at my mom and my dad — (Laughter) Karolina and Karl, and grandmom and granddad, ",Josefine,and Josef,PERSON
220,6,19,""" Then, of course, I looked at my mom and my dad — (Laughter) Karolina and Karl, and grandmom and granddad, Josefine and ",Josef, So I am looking still for a Stephanie,PERSON
220,6,20, So I am looking still for a ,Stephanie, I'll figure something out,LOC
220,9,2," So in this case, it's an outside projection for ",Singapore,on these giant Times Square-like screens,LOC
220,9,3," So in this case, it's an outside projection for Singapore on these giant ",Times Square,like screens,ORG
220,9,4," In this case, """,Keeping a Diary Supports Personal Development, — I've been keeping a diary since I was 12,WORK_OF_ART
221,15,6," Even if you imagine that this room we are in now exists and is real and here we are, and we have, not only our memories, but our impression that outside there's something called Caltech and the United States and the Milky Way Galaxy, it's much easier for all those impressions to randomly fluctuate into your brain than for them actually to randomly fluctuate into ",Caltech, the United States and the galaxy,ORG
221,15,7," Even if you imagine that this room we are in now exists and is real and here we are, and we have, not only our memories, but our impression that outside there's something called Caltech and the United States and the Milky Way Galaxy, it's much easier for all those impressions to randomly fluctuate into your brain than for them actually to randomly fluctuate into Caltech, ",the United States,and the galaxy,LOC
221,21,1," And even better, we will understand what happened at ",the Big Bang,in terms of a theory that we will be able to compare to observations,ORG
222,1,7," And it brings you into the presence of what's been called God, Nirvana, ",Rama, Tao,PERSON
222,1,8," And it brings you into the presence of what's been called God, Nirvana, Rama, ",Tao, Something that goes beyond what we know in our ego-bound existence,PERSON
222,12,1,"But I'd just like to quote, finish at the end with a reference to a British author, an ",Oxford,"author whom I don't quote very often, C",ORG
222,12,2,"But I'd just like to quote, finish at the end with a reference to a British author, an Oxford author whom I don't quote very often, ",C.S. Lewis, But he wrote one thing that stuck in my mind ever since I read it when I was a schoolgirl,PERSON
222,12,4, It's in his book ,"""The Four Loves",""" He said that he distinguished between erotic love, when two people gaze, spellbound, into each other's eyes",WORK_OF_ART
223,1,10,"' 'White is leaving,' ",Steve,said somberly,PERSON
223,9,8, 'Come to the ,Florida,sunshine bush,LOC
223,9,9, Come to the ,Florida,"sunshine bush, where there are lemons, where they make demons",LOC
223,14,7, ,Kaplan,would later describe me as 'writhing in agony,ORG
223,17,6," Third, I work at an enormously supportive workplace at ",USC Law School, This is a place that not only accommodates my needs but actually embraces them,ORG
223,20,0,"Recently, a friend posed a question: If there were a pill I could take that would instantly cure me, would I take it? The poet ",Rainer Maria Rilke,was offered psychoanalysis,PERSON
223,20,1, What those of us who suffer with mental illness want is what everybody wants: in the words of ,Sigmund Freud," ""to work and to love",PERSON
224,3,6, And Asanga lived 800 years after the ,Buddha,s time,PERSON
224,3,8, And he was discontented with the state of people's practice of the Buddhist religion in ,India,at that time,LOC
224,32,0," And then, not only will God smile and the eternal mama will smile, but ",Karen Armstrong,will smile,PERSON
225,11,9, ,Frank Wilson,"had written a book called ""The Hand",PERSON
225,11,10," Frank Wilson had written a book called """,The Hand,""" They got together — JPL hired them",WORK_OF_ART
225,11,11,""" They got together — ",JPL,hired them,ORG
225,11,12, Now ,JPL," NASA and Boeing, before they will hire a research and development problem solver — even if they're summa cum laude from Harvard or Cal Tech — if they haven't fixed cars, haven't done stuff with their hands early in life, played with their hands, they can't problem-solve as well",ORG
225,11,13," Now JPL, ",NASA,"and Boeing, before they will hire a research and development problem solver — even if they're summa cum laude from Harvard or Cal Tech — if they haven't fixed cars, haven't done stuff with their hands early in life, played with their hands, they can't problem-solve as well",ORG
225,11,14," Now JPL, NASA and ",Boeing," before they will hire a research and development problem solver — even if they're summa cum laude from Harvard or Cal Tech — if they haven't fixed cars, haven't done stuff with their hands early in life, played with their hands, they can't problem-solve as well",ORG
225,11,15," Now JPL, NASA and Boeing, before they will hire a research and development problem solver — even if they're summa cum laude from ",Harvard,"or Cal Tech — if they haven't fixed cars, haven't done stuff with their hands early in life, played with their hands, they can't problem-solve as well",ORG
225,11,16," Now JPL, NASA and Boeing, before they will hire a research and development problem solver — even if they're summa cum laude from Harvard or ",Cal Tech,"— if they haven't fixed cars, haven't done stuff with their hands early in life, played with their hands, they can't problem-solve as well",ORG
225,33,4," And Brendan Boyle, Rich Crandall — and on the far right is, I think, a person who will be in cahoots with ",George Smoot,"for a Nobel Prize — Stuart Thompson, in neuroscience",PERSON
225,33,5," And Brendan Boyle, Rich Crandall — and on the far right is, I think, a person who will be in cahoots with George Smoot for ",a Nobel Prize,"— Stuart Thompson, in neuroscience",WORK_OF_ART
225,33,6," And Brendan Boyle, Rich Crandall — and on the far right is, I think, a person who will be in cahoots with George Smoot for a Nobel Prize — ",Stuart Thompson, in neuroscience,ORG
225,33,7, So we've had ,Brendan," who's from IDEO, and the rest of us sitting aside and watching these students as they put play principles into practice in the classroom",PERSON
225,47,3," Well, let's round these kids up, put them in pens and make them play for months at a time; they'll all be geniuses and go to ",Harvard,""" How do you prevent people from taking that sort of action on the data that you're developing?",ORG
225,49,1,"Unfortunately, that hasn't been done sufficiently for the National Science Foundation, ",National Institute of Mental Health,or anybody else to really look at it in this way seriously,ORG
225,50,0,JH: ,Stuart Brown, thank you very much,PERSON
226,8,4, Have you ever seen those stratus clouds that go in parallel stripes across the sky? Did you know that's a continuous sheet of cloud that's dipping in and out of the condensation layer? What if every seemingly isolated object was actually just where the continuous wave of that object poked through into our world? The ,Earth,is neither flat nor round,LOC
226,19,0," (JC: Thank you, ",Reuben,),PERSON
227,21,0,♫ ,Blue river,♫,LOC
227,45,0,♫ ,Blue river,♫,LOC
227,47,0,♫ ,Blue river,♫,LOC
228,16,9, And ,the Clinton Foundation,and WHO believe that they can treat three million people worldwide by 2005 — two million in sub-Saharan Africa,ORG
228,16,10, And the Clinton Foundation and ,WHO,believe that they can treat three million people worldwide by 2005 — two million in sub-Saharan Africa,ORG
228,20,5, This is a tipping point — if ,Malcolm,"s here, forgive me — and it's going to change the economics, and the speed, and the players in the industry",PERSON
228,24,0,"And the consequence of cheap phone calling, free phone calling, to ",India," is the pissed-off programmer, is the outsourcing",LOC
228,24,2, The force of ,India," and then China, and any other country that can contact our markets and will work with our companies — because the communications are free — is just beginning to be felt",LOC
228,24,3," The force of India, and then ",China, and any other country that can contact our markets and will work with our companies — because the communications are free — is just beginning to be felt,LOC
229,10,13," (Laughter) It's interesting how, in 2009, Gizmodo basically defined, said that this project actually gives a meaning to ",Twitter, so it was — a lot changed in between,ORG
229,11,11," They learned how to program and to make robots when they were probably, like, 11, and then they started to use ",Arduino,to make these robots that play football,ORG
229,11,12, They became world champions by making an ,Arduino,based robot,ORG
229,14,5, And they prototyped with an old LCD screen from a ,Nokia,mobile phone and an Arduino,ORG
229,14,6, And they prototyped with an old LCD screen from a Nokia mobile phone and an ,Arduino," And then, when they had a final project, they actually went to Kickstarter and they were asking for 100,000 dollars to make a few of them to sell",ORG
229,14,7," And then, when they had a final project, they actually went to ",Kickstarter,"and they were asking for 100,000 dollars to make a few of them to sell",PERSON
229,15,3, So if you know how to use ,Arduino, you can actually upload your experiments into this satellite and run them,ORG
229,19,1,Chris Anderson: ,Massimo," you told me earlier today that you had no idea, of course, that it would take off like this",LOC
230,10,9," Its position, of course, in the middle of Manhattan — it's on ",Hunter,s Point,PERSON
230,24,2, And we spent some time with ,Conan," believe it or not, and then that led us to, kind of, the very differences of our worlds from a legal and an artistic, architectural",PERSON
230,24,3, You'll find a stair that's the same length as ,the Supreme Court," Here's a piano nobile, which is a device used in the Renaissance",ORG
230,24,4," Here's a piano nobile, which is a device used in the ",Renaissance, The courts were made of that,ORG
231,0,3, And using a fork to pick up a piece of broccoli from a ,Styrofoam,plate without driving the fork through the plate is going to be as difficult as brain surgery,ORG
232,11,15, Actually I had ,Cisplatin, Doxorubicin and very high-dose Methotrexate,LOC
232,11,16," Actually I had Cisplatin, Doxorubicin and very high-dose ",Methotrexate,,PERSON
232,24,1,"And I just want to mention briefly in passing — I'm past my time limit — but I just want to briefly mention in passing that one of the nice things that can come out of a conference like this is, at a similar meeting, back in the spring, ",Anne Wojcicki,"heard about our story and very quickly — in a span of three weeks — put the full resources of 23andMe, and we announced an initiative in July to get to decode the genome of anybody, a living person with a heart tissue, bone sarcoma",PERSON
232,24,10," And the epidemiologists here will tell you, that's half the number of people who get the disease in one year in ",the United States," So if you go to 23andMe, or if you go to councilofdads",LOC
233,8,3," A living, breathing comic book series, but unlike Spiderman and ",Iron Man, these guys can actually do it,PERSON
233,8,5, We got ,Madd Chadd," Lil' C, Kid David and J Smooth",ORG
233,8,6," We got Madd Chadd, ",Lil," C, Kid David and J Smooth",PERSON
233,8,7," We got Madd Chadd, Lil' C, ",Kid David,and J Smooth,PERSON
233,16,0,Kid ,David," It's kind of like, honestly a lot of times I don't really know what's going on when I'm dancing",PERSON
233,16,1," So, it was always like, they called me ",Kid David, because I was the kid,PERSON
234,22,7," Jodi Lomask, and her wonderful troupe Capacitor, joined me in the canopy in my rainforest site in ",Costa Rica," They made a fabulous dance called ""Biome",LOC
234,33,0, And so I'm hoping that my husband ,Jack," the ant taxonomist, can perhaps work with Mattel to make Taxonomist Ken",PERSON
234,33,1," And so I'm hoping that my husband Jack, the ant taxonomist, can perhaps work with ",Mattel,to make Taxonomist Ken,ORG
234,33,2," And so I'm hoping that my husband Jack, the ant taxonomist, can perhaps work with Mattel to make ",Taxonomist Ken, Perhaps Ben Zander and Bill Gates could get together and make an opera about AIDS,PERSON
234,33,3, Perhaps ,Ben Zander,and Bill Gates could get together and make an opera about AIDS,PERSON
234,33,4, Perhaps Ben Zander and ,Bill Gates,could get together and make an opera about AIDS,PERSON
234,33,5, Or perhaps ,Al Gore,and Naturally 7 could make a song about climate change that would really make you clap your hands,PERSON
234,33,6, Or perhaps Al Gore and ,Naturally 7,could make a song about climate change that would really make you clap your hands,PERSON
235,1,19, The picture on India is the ,Dharavi,slum of Mumbai in India,ORG
235,1,20, The picture on India is the Dharavi slum of ,Mumbai,in India,LOC
235,1,21, The picture on India is the Dharavi slum of Mumbai in ,India, The idea there behind these two pictures is that the Chinese government can act above rule of law,LOC
235,1,25, Whereas in ,India," you cannot do that, because you have to listen to the public",LOC
235,1,26, Even Prime Minister ,Manmohan Singh,agrees with that view,PERSON
235,1,27, In an interview printed in the financial press of ,India, He said that he wants to make Mumbai another Shanghai,LOC
235,1,28," In an interview printed in the financial press of India, He said that he wants to make ",Mumbai,another Shanghai,LOC
235,1,29," In an interview printed in the financial press of India, He said that he wants to make Mumbai another ",Shanghai," This is an Oxford-trained economist steeped in humanistic values, and yet he agrees with the high-pressure tactics of Shanghai",LOC
235,1,30, This is an ,Oxford,"trained economist steeped in humanistic values, and yet he agrees with the high-pressure tactics of Shanghai",PERSON
235,1,31," This is an Oxford-trained economist steeped in humanistic values, and yet he agrees with the high-pressure tactics of ",Shanghai,,LOC
235,5,18," So clearly, infrastructure doesn't explain why China did better before the late 1990s, as compared with ",India,,LOC
235,14,14," If you look at other East Asian countries, women there play a hugely important role in terms of economic take-off — in terms of creating the manufacturing miracle associated with ",East Asia, India still has a long way to go to catch up with China,LOC
235,14,15, ,India,still has a long way to go to catch up with China,LOC
235,14,16, India still has a long way to go to catch up with ,China,,LOC
235,18,3," In fact, if you compare India with the average developing country, even before the more recent period of acceleration of Indian growth — now ",India,"is growing between eight and nine percent — even before this period, India was ranked fourth in terms of economic growth among emerging economies",LOC
235,18,5, If you are a ,NBA,"player and you are always being compared to Michael Jordan, you're going to look not so impressive",ORG
235,18,6, If you are a NBA player and you are always being compared to ,Michael Jordan, you're going to look not so impressive,PERSON
235,18,7," In fact, if you compare ",India,"with the average developing country, even before the more recent period of acceleration of Indian growth — now India is growing between eight and nine percent — even before this period, India was ranked fourth in terms of economic growth among emerging economies",LOC
235,18,9," In fact, if you compare India with the average developing country, even before the more recent period of acceleration of Indian growth — now ",India,"is growing between eight and nine percent — even before this period, India was ranked fourth in terms of economic growth among emerging economies",LOC
235,18,11," In fact, if you compare India with the average developing country, even before the more recent period of acceleration of Indian growth — now India is growing between eight and nine percent — even before this period, ",India,was ranked fourth in terms of economic growth among emerging economies,LOC
235,19,3, ,India,"has the right institutional conditions for economic growth, whereas China is still struggling with political reforms",LOC
235,19,4," India has the right institutional conditions for economic growth, whereas ",China,is still struggling with political reforms,LOC
