talk_id,para_id,entity_id,before,entities,after,label
159,13,6," The man was asleep, but he heard the words bread, temple, ",God, and he woke up,PERSON
159,13,7, I know what ,God,wants,PERSON
159,18,0, ,Rabbis,always spoil things,PERSON
160,19,6, Number one group on ,Meetup,"right now, most chapters in most cities with most members, most active? Stay-at-home moms",PERSON
160,19,7," Right? In the suburbanized, dual-income ",United States," stay-at-home moms are actually missing the social infrastructure that comes from extended family and local, small-scale neighborhoods",LOC
160,19,8, ,Meetup,"is the platform, but the value here is in social infrastructure",PERSON
160,19,10, This is so much more important than ,Xbox, but it's a lot less glitzy,PERSON
161,28,4, One of the great stories I love to tell is about my love of going to my hometown of New York and walking up ,Park Avenue,on a beautiful day and admiring everything and seeing all the people go by from all over the world,ORG
161,28,5, I even did it when I was Secretary of ,State," I'd come out of my suite at the Waldorf Astoria — (Laughter) — be walking up the street, and I would hit around 55th Street looking for the immigrant pushcart peddler",ORG
161,28,6, I'd come out of my suite at ,the Waldorf Astoria,"— (Laughter) — be walking up the street, and I would hit around 55th Street looking for the immigrant pushcart peddler",ORG
161,28,7," I'd come out of my suite at the Waldorf Astoria — (Laughter) — be walking up the street, and I would hit around ",55th Street,looking for the immigrant pushcart peddler,ORG
161,28,11," In those days, I had five bodyguards around me and three ",New York City,police cars would roll alongside to make sure nobody whacked me while I was going up Park Avenue,LOC
161,28,12," In those days, I had five bodyguards around me and three New York City police cars would roll alongside to make sure nobody whacked me while I was going up ",Park Avenue," (Laughter) And I would order the hot dog from the guy, and he'd start to fix it, and then he'd look around at the bodyguards and the police cars — ""I've got a green card! I've got a green card!"" (Laughter) ""It's okay, it's okay",ORG
161,30,3, It was on a Tuesday evening down by ,Columbus Circle, And the scene repeats itself so often,LOC
162,13,7, Francis of ,Assisi," Gandhi — he adored his contemporary, Gandhi",LOC
162,13,8," Francis of Assisi, ",Gandhi,"— he adored his contemporary, Gandhi",PERSON
162,13,9," Francis of Assisi, Gandhi — he adored his contemporary, ",Gandhi," And Einstein said — and I think this is a quote, again, that has not been passed down in his legacy — that ""these kinds of people are geniuses in the art of living, more necessary to the dignity, security and joy of humanity than the discoverers of objective knowledge",PERSON
162,13,10, And ,Einstein,"said — and I think this is a quote, again, that has not been passed down in his legacy — that ""these kinds of people are geniuses in the art of living, more necessary to the dignity, security and joy of humanity than the discoverers of objective knowledge",PERSON
162,16,2, ,Einstein,"became a humanitarian, not because of his exquisite knowledge of space and time and matter, but because he was a Jew as Germany grew fascist",PERSON
162,16,3," Einstein became a humanitarian, not because of his exquisite knowledge of space and time and matter, but because he was a ",Jew,as Germany grew fascist,PERSON
162,16,4," Einstein became a humanitarian, not because of his exquisite knowledge of space and time and matter, but because he was a Jew as ",Germany,grew fascist,LOC
162,16,5, And ,Karen Armstrong," I think you would also say that it was some of your very wounding experiences in a religious life that, with a zigzag, have led to the Charter for Compassion",PERSON
162,16,6," And Karen Armstrong, I think you would also say that it was some of your very wounding experiences in a religious life that, with a zigzag, have led to ",the Charter for Compassion, Compassion can't be reduced to sainthood any more than it can be reduced to pity,ORG
162,17,1,So I want to propose a final definition of compassion — this is Einstein with ,Paul Robeson,by the way — and that would be for us to call compassion a spiritual technology,PERSON
162,18,0,So I will paraphrase ,Einstein,"in closing and say that humanity, the future of humanity, needs this technology as much as it needs all the others that have now connected us and set before us the terrifying and wondrous possibility of actually becoming one human race",PERSON
163,6,11, We are missing the stories of ,Violet," who, despite surviving genocide in the church massacre, she kept on going on, burying bodies, cleaning homes, cleaning the streets",ORG
163,15,0,,Rumi," a 13th-century Sufi poet, says, ""Out beyond the worlds of right-doings and wrong-doings, there is a field",ORG
164,36,8," Over here, ",Tommy,s got what you call the heart position,PERSON
164,50,0,AK: ,Mikey Brett,from Leicestershire,PERSON
164,50,1,AK: Mikey Brett from ,Leicestershire," (Applause) Mikey Brett, Craig, Leo, Zem Joaquin and Basil and me",LOC
164,50,2, (Applause) ,Mikey Brett," Craig, Leo, Zem Joaquin and Basil and me",PERSON
164,50,3," (Applause) Mikey Brett, ",Craig," Leo, Zem Joaquin and Basil and me",PERSON
164,50,4," (Applause) Mikey Brett, Craig, ",Leo, Zem Joaquin and Basil and me,PERSON
164,50,5," (Applause) Mikey Brett, Craig, Leo, ",Zem Joaquin,and Basil and me,PERSON
164,50,6," (Applause) Mikey Brett, Craig, Leo, Zem Joaquin and ",Basil,and me,PERSON
165,25,12,""" I said, ""Any chance you know Willie Brown?"" (Laughter) As a matter of fact he did know Willie Brown, and ",Willie Brown,"and Herbie and I had dinner four years ago, and we started drawing out that center on the tablecloth",PERSON
165,25,13,""" I said, ""Any chance you know Willie Brown?"" (Laughter) As a matter of fact he did know Willie Brown, and Willie Brown and ",Herbie,"and I had dinner four years ago, and we started drawing out that center on the tablecloth",PERSON
165,25,15, And ,Willie Brown,"said, ""As sure as I'm the mayor of San Francisco, I'm going to build this thing as a legacy to the poor people of this city",PERSON
165,25,16," And Willie Brown said, ""As sure as I'm the mayor of ",San Francisco, I'm going to build this thing as a legacy to the poor people of this city,LOC
165,25,18,""" And he got me five acres of land on ",San Francisco Bay,"and we got an architect and we got a general contractor and we got Herbie on the board, and our friends from HP, and our friends from Steelcase, and our friends from Cisco, and our friends from Wells Fargo and Genentech",LOC
165,25,19,""" And he got me five acres of land on San Francisco Bay and we got an architect and we got a general contractor and we got Herbie on the board, and our friends from ",HP," and our friends from Steelcase, and our friends from Cisco, and our friends from Wells Fargo and Genentech",LOC
165,25,20,""" And he got me five acres of land on San Francisco Bay and we got an architect and we got a general contractor and we got Herbie on the board, and our friends from HP, and our friends from ",Steelcase," and our friends from Cisco, and our friends from Wells Fargo and Genentech",PERSON
165,25,21,""" And he got me five acres of land on San Francisco Bay and we got an architect and we got a general contractor and we got Herbie on the board, and our friends from HP, and our friends from Steelcase, and our friends from ",Cisco, and our friends from Wells Fargo and Genentech,LOC
165,25,22,""" And he got me five acres of land on San Francisco Bay and we got an architect and we got a general contractor and we got Herbie on the board, and our friends from HP, and our friends from Steelcase, and our friends from Cisco, and our friends from ",Wells Fargo,and Genentech,ORG
165,25,23,""" And he got me five acres of land on San Francisco Bay and we got an architect and we got a general contractor and we got Herbie on the board, and our friends from HP, and our friends from Steelcase, and our friends from Cisco, and our friends from Wells Fargo and ",Genentech,,ORG
165,29,0, In ,Pennsylvania,"it costs 60,000 dollars to keep people in jail, most of whom look like me",LOC
165,29,3," It's 40,000 dollars to build ",the University of Pittsburgh Medical School," It's 20,000 dollars cheaper to build a medical school than to keep people in jail",ORG
165,29,5, I am banking on you and I'm banking on guys like ,Herbie,and Quincy and Hackett and Richard and very decent people who still believe in something,LOC
165,29,6, I am banking on you and I'm banking on guys like Herbie and ,Quincy,and Hackett and Richard and very decent people who still believe in something,PERSON
165,29,7, I am banking on you and I'm banking on guys like Herbie and Quincy and ,Hackett,and Richard and very decent people who still believe in something,PERSON
165,29,8, I am banking on you and I'm banking on guys like Herbie and Quincy and Hackett and ,Richard,and very decent people who still believe in something,PERSON
166,6,15, What I have showed you here is only the species from ,Africa, Adansonia digitata,LOC
166,6,16," What I have showed you here is only the species from Africa, ",Adansonia,digitata,LOC
166,6,18, We have six species yet in ,Madagascar," and we don't know what is the potential of this plant, but one thing we know is that the flora is considered to be threatened with extinction",LOC
166,10,1," Now, ",Centella,"asiatica grows across the world in many different habitats — in Africa, in Asia — and this plant has been instrumental in providing a solution to that dreadful disease called leprosy in Madagascar in the 1940s",PERSON
166,10,2," Now, Centella asiatica grows across the world in many different habitats — in ",Africa, in Asia — and this plant has been instrumental in providing a solution to that dreadful disease called leprosy in Madagascar in the 1940s,LOC
166,10,3," Now, Centella asiatica grows across the world in many different habitats — in Africa, in ",Asia,— and this plant has been instrumental in providing a solution to that dreadful disease called leprosy in Madagascar in the 1940s,LOC
166,10,4," Now, Centella asiatica grows across the world in many different habitats — in Africa, in Asia — and this plant has been instrumental in providing a solution to that dreadful disease called leprosy in ",Madagascar,in the 1940s,LOC
166,10,6," Now, while ",Centella,"grows across the world — in Africa, in Asia — the best quality Centella comes from Madagascar, because that Centella contains the three vital ingredients which are sought after by the pharma and the cosmetic companies",PERSON
166,10,7," Now, while Centella grows across the world — in ",Africa," in Asia — the best quality Centella comes from Madagascar, because that Centella contains the three vital ingredients which are sought after by the pharma and the cosmetic companies",LOC
166,10,8," Now, while Centella grows across the world — in Africa, in ",Asia,"— the best quality Centella comes from Madagascar, because that Centella contains the three vital ingredients which are sought after by the pharma and the cosmetic companies",LOC
166,10,9," Now, while Centella grows across the world — in Africa, in Asia — the best quality ",Centella,"comes from Madagascar, because that Centella contains the three vital ingredients which are sought after by the pharma and the cosmetic companies",PERSON
166,10,10," Now, while Centella grows across the world — in Africa, in Asia — the best quality Centella comes from ",Madagascar, because that Centella contains the three vital ingredients which are sought after by the pharma and the cosmetic companies,LOC
166,10,11," Now, while Centella grows across the world — in Africa, in Asia — the best quality Centella comes from Madagascar, because that ",Centella,contains the three vital ingredients which are sought after by the pharma and the cosmetic companies,PERSON
166,11,0, So you may look on ,Centella,"as being an insignificant, humble weed, which, if destroyed, won't be missed",PERSON
167,3,7," They are sold in the name of forced labor, ",camel jockeying," anything, everything",ORG
167,18,0,I'm not asking you all to become ,Mahatma Gandhis,"or Martin Luther Kings, or Medha Patkars, or something like that",PERSON
167,18,1,I'm not asking you all to become Mahatma Gandhis or ,Martin Luther Kings," or Medha Patkars, or something like that",PERSON
167,18,2,"I'm not asking you all to become Mahatma Gandhis or Martin Luther Kings, or ",Medha Patkars, or something like that,PERSON
168,18,12," And we're also doing a movie called ""The Kite Runner,"" based on the book ""The Kite Runner,"" also about ",Afghanistan," And we think once people see these films, they'll have a much better understanding of that part of the world and the Middle East in general",LOC
168,18,13," And we think once people see these films, they'll have a much better understanding of that part of the world and ",the Middle East,in general,LOC
168,21,1," And I can imagine, if we do this, the headlines in 10 years might read something like these: ""New AIDS Cases in ",Africa,"Fall to Zero,"" ""U",LOC
168,21,3," And I can imagine, if we do this, the headlines in 10 years might read something like these: ""New AIDS Cases in Africa Fall to Zero,"" """,U.S.,"Imports its Last Barrel of Oil"" — (Applause) — ""Israelis and Palestinians Celebrate 10 Years of Peaceful Coexistence",LOC
168,21,7,""" (Applause) And I like this one, """,Snow Has Returned to Kilimanjaro,""" (Laughter) And finally, an eBay listing for one well-traveled slide show, now obsolete, museum piece",WORK_OF_ART
168,21,8,""" (Laughter) And finally, an ",eBay,"listing for one well-traveled slide show, now obsolete, museum piece",ORG
168,21,10, Please contact ,Al Gore," And I believe that, working together, we can make all of these things happen",PERSON
169,18,14, So we can say with a high degree of confidence that the severe ,Texas,and Moscow heatwaves were not natural; they were caused by global warming,LOC
169,18,15, So we can say with a high degree of confidence that the severe Texas and ,Moscow,heatwaves were not natural; they were caused by global warming,LOC
169,18,16," An important impact, if global warming continues, will be on the breadbasket of our nation and the world, the ",Midwest,"and Great Plains, which are expected to become prone to extreme droughts, worse than the Dust Bowl, within just a few decades, if we let global warming continue",LOC
169,18,17," An important impact, if global warming continues, will be on the breadbasket of our nation and the world, the Midwest and ",Great Plains," which are expected to become prone to extreme droughts, worse than the Dust Bowl, within just a few decades, if we let global warming continue",ORG
170,18,0,"♫ Together: The Jill and Julia, the ",Jill,"and Julia, the Jill and Julia Show",PERSON
170,18,1,"♫ Together: The Jill and Julia, the Jill and Julia, the ",Jill,and Julia Show,PERSON
170,47,2," I mean, I watch Oprah mostly when I'm home in ",Spokane,visiting my mother,ORG
170,47,3," And to my mother, ",Oprah,"is a greater moral authority than the Pope, which is actually saying something because she's a devout Catholic",PERSON
170,47,5," Anyway, I like ",Oprah,"— I like her girlfriendy-ness, I like her weight issues, I like how she's transformed talk television, I like how she's brought reading back to America — but there was something that happened the last two weeks that was ",PERSON
170,47,6," Anyway, I like Oprah — I like her girlfriendy-ness, I like her weight issues, I like how she's transformed talk television, I like how she's brought reading back to ",America,— but there was something that happened the last two weeks that was ,LOC
170,47,9," And that was that she did two entire shows promoting that movie """,The Secret,""" Do you guys know about that movie ""The Secret""? It makes ""What the Bleep Do We Know"" seem like a doctoral dissertation from Harvard on quantum mechanics — that's how bad it is",WORK_OF_ART
170,47,10,""" Do you guys know about that movie """,The Secret,"? It makes ""What the Bleep Do We Know"" seem like a doctoral dissertation from Harvard on quantum mechanics — that's how bad it is",WORK_OF_ART
170,47,11,""" Do you guys know about that movie ""The Secret""? It makes """,What the Bleep Do We Know, seem like a doctoral dissertation from Harvard on quantum mechanics — that's how bad it is,WORK_OF_ART
170,47,12,""" Do you guys know about that movie ""The Secret""? It makes ""What the Bleep Do We Know"" seem like a doctoral dissertation from ",Harvard,on quantum mechanics — that's how bad it is,ORG
170,47,13,""" Do you guys know about that movie ""The Secret""? It makes ""What the Bleep Do We Know"" seem like a doctoral dissertation from Harvard on ",quantum mechanics,— that's how bad it is,ORG
170,47,14," It makes """,The DaVinci Code," seem like ""War and Peace",WORK_OF_ART
170,47,15," It makes ""The DaVinci Code"" seem like """,War and Peace,""" That movie is so horrible",WORK_OF_ART
170,47,16," On a scientific basis, it's more than just """,Power of Positive Thinking," — it has a horrible, horrible dark side",WORK_OF_ART
170,47,17, And all I'm saying is that I really wish that ,Murray Gell-Mann,"would go on Oprah and just explain to her that the law of attraction is, in fact, not a law",PERSON
170,47,18, And all I'm saying is that I really wish that Murray Gell-Mann would go on ,Oprah,"and just explain to her that the law of attraction is, in fact, not a law",PERSON
170,51,0,"♫ Together: The Jill and Julia, the ",Jill,"and Julia, the Jill and Julia Show",PERSON
170,51,1,"♫ Together: The Jill and Julia, the Jill and Julia, the ",Jill,and Julia Show,PERSON
171,0,1,"In 1977, the physicist ",Edward Purcell,"calculated that if you push a bacteria and then let go, it will stop in about a millionth of a second",PERSON
171,0,5," In 1883, the physicist ",Osborne Reynolds,figured out that there is one simple number that can predict how a fluid will behave,PERSON
171,0,7, It's called the ,Reynolds,"number, and it depends on simple properties like the size of the swimmer, its speed, the density of the fluid, and the stickiness, or the viscosity, of the fluid",PERSON
171,0,8," Meanwhile, sperm live in a low ",Reynolds,number world,PERSON
171,0,9," To imagine what it would feel like to be a sperm, you need to bring yourself down to its ",Reynolds,number,ORG
171,0,11," By cleverly flexing their paddle to create more drag on the power stroke than on the recovery stroke, single-celled organisms like ",paramecia,manage to inch their way through the crowd of water molecules,LOC
171,0,12, Some bacteria take ,Batman,s approach,PERSON
171,0,13, ,H. pylori,"lives only in the slimy, acidic mucus inside our stomachs",PERSON
172,16,5, My colleagues ,Tal Yarkoni,and Russ Poldrack have shown that the insula pops up in almost a third of all brain imaging studies that have ever been published,PERSON
172,16,6, My colleagues Tal Yarkoni and ,Russ Poldrack,have shown that the insula pops up in almost a third of all brain imaging studies that have ever been published,PERSON
172,20,2," These scans, the clinics say, can help prevent Alzheimer's disease, solve weight and addiction issues, overcome marital conflicts, and treat, of course, a variety of mental illnesses ranging from depression to anxiety to ",ADHD, This sounds great,ORG
173,17,13," And in fact, George Bush and ",Tony Blair,are having great fun during all of this,PERSON
173,19,1," So, ",Jamie Oliver,"and school dinners; Bush and Blair having difficulty getting alongside Muslim culture; the whole of the hunting issue, and the royal family refusing to stop hunting; and the tsunami issues; and obviously Harry; Blair's views on Gordon Brown, which I find very interesting; Condi and Bush",PERSON
173,19,2," So, Jamie Oliver and school dinners; ",Bush,"and Blair having difficulty getting alongside Muslim culture; the whole of the hunting issue, and the royal family refusing to stop hunting; and the tsunami issues; and obviously Harry; Blair's views on Gordon Brown, which I find very interesting; Condi and Bush",PERSON
173,19,3," So, Jamie Oliver and school dinners; Bush and ",Blair,"having difficulty getting alongside Muslim culture; the whole of the hunting issue, and the royal family refusing to stop hunting; and the tsunami issues; and obviously Harry; Blair's views on Gordon Brown, which I find very interesting; Condi and Bush",PERSON
173,19,5," So, Jamie Oliver and school dinners; Bush and Blair having difficulty getting alongside Muslim culture; the whole of the hunting issue, and the royal family refusing to stop hunting; and the tsunami issues; and obviously ",Harry," Blair's views on Gordon Brown, which I find very interesting; Condi and Bush",PERSON
173,19,6," So, Jamie Oliver and school dinners; Bush and Blair having difficulty getting alongside Muslim culture; the whole of the hunting issue, and the royal family refusing to stop hunting; and the tsunami issues; and obviously Harry; ",Blair,"s views on Gordon Brown, which I find very interesting; Condi and Bush",PERSON
173,19,7," So, Jamie Oliver and school dinners; Bush and Blair having difficulty getting alongside Muslim culture; the whole of the hunting issue, and the royal family refusing to stop hunting; and the tsunami issues; and obviously Harry; Blair's views on ",Gordon Brown, which I find very interesting; Condi and Bush,PERSON
173,19,8," So, Jamie Oliver and school dinners; Bush and Blair having difficulty getting alongside Muslim culture; the whole of the hunting issue, and the royal family refusing to stop hunting; and the tsunami issues; and obviously Harry; Blair's views on Gordon Brown, which I find very interesting; ",Condi,and Bush,PERSON
173,19,9," So, Jamie Oliver and school dinners; Bush and Blair having difficulty getting alongside Muslim culture; the whole of the hunting issue, and the royal family refusing to stop hunting; and the tsunami issues; and obviously Harry; Blair's views on Gordon Brown, which I find very interesting; Condi and ",Bush, This image I've decided to show having a reservation about it,PERSON
173,20,0,,Chris Anderson, Thank you,PERSON
174,0,4, Since ,Emile Boirac,"introduced déjà vu as a French term meaning ""already seen,"" more than 40 theories attempt to explain this phenomenon",PERSON
175,3,5," That little hole in the middle there is for the pollen tube, and when the pollen finds its special female spot in another ",Morina,"flower, just on the right species, what happens? Like I said, pollen carries the male sex cells",LOC
175,6,3," And I'm rather proud to say that this was found just near London, and that 55 million years ago ",London,was full of mangroves,LOC
175,10,2," And finally, in a rather grizzly way, the ",Bosnia,"war crimes; some of the people brought to trial were brought to trial because of the evidence from pollen, which showed that bodies had been buried, exhumed and then reburied somewhere else",LOC
175,11,0, Thank you to the colleagues at ,Kew, and thank you to palynologists everywhere,PERSON
176,6,8," These are not just crop plants, as you might have seen stored in ",Svalbard,in Norway — fantastic work there,ORG
176,6,9," These are not just crop plants, as you might have seen stored in Svalbard in ",Norway,— fantastic work there,LOC
176,6,12, We have thousands of collections that have been sent out all over the world: drought-tolerant forest species sent to ,Pakistan,and Egypt; especially photosynthetic-efficient plants come here to the United States; salt-tolerant pasture species sent to Australia; the list goes on and on,LOC
176,6,13, We have thousands of collections that have been sent out all over the world: drought-tolerant forest species sent to Pakistan and ,Egypt, especially photosynthetic-efficient plants come here to the United States; salt-tolerant pasture species sent to Australia; the list goes on and on,LOC
176,6,14, We have thousands of collections that have been sent out all over the world: drought-tolerant forest species sent to Pakistan and Egypt; especially photosynthetic-efficient plants come here to ,the United States, salt-tolerant pasture species sent to Australia; the list goes on and on,LOC
176,6,15, We have thousands of collections that have been sent out all over the world: drought-tolerant forest species sent to Pakistan and Egypt; especially photosynthetic-efficient plants come here to the United States; salt-tolerant pasture species sent to ,Australia, the list goes on and on,LOC
176,8,0,We have training going on in ,China," in the USA, and many other countries",LOC
176,8,1,"We have training going on in China, in the ",USA, and many other countries,LOC
178,17,17, Protected areas provide hope that the creatures of ,Ed Wilson's,"dream of an encyclopedia of life, or the census of marine life, will live not just as a list, a photograph, or a paragraph",PERSON
178,18,6, 97 percent of the land in ,the Galapagos Islands,"is protected, but the adjacent sea is being ravaged by fishing",LOC
178,18,7, It's true too in ,Argentina,"on the Patagonian shelf, which is now in serious trouble",LOC
178,18,9," The high seas, where whales, tuna and dolphins travel — the largest, least protected, ecosystem on ",Earth," filled with luminous creatures, living in dark waters that average two miles deep",LOC
179,15,7,"' And the thing is,"" says ",Ira Glass," ""we need this",PERSON
179,16,4, And ,Hosni Mubarak,"thought he was going to be the dictator of Egypt for the rest of his life, until he got too old or too sick and could pass the reigns of power onto his son",PERSON
